{
  "kind": "aok-work-item-type-catalog",
  "version": 1,
  "maxTypes": 19,
  "commonSections": [
    {"id": "outcome", "label": "Outcome or Problem", "description": "State the user, business, operational, or technical outcome and why it matters.", "required": true, "multiline": true},
    {"id": "scope", "label": "Scope and Exclusions", "description": "List what is included and explicitly excluded.", "required": true, "multiline": true},
    {"id": "acceptance", "label": "Acceptance Criteria", "description": "Provide measurable completion criteria, one per line.", "required": true, "multiline": true},
    {"id": "target-repo", "label": "Target Repository", "description": "Name the repository or repositories where delivery work belongs.", "required": true, "multiline": false},
    {"id": "dependencies", "label": "Dependencies", "description": "List prerequisite work, decisions, systems, and blocking relationships; write None when empty.", "required": true, "multiline": true},
    {"id": "risks", "label": "Risks and Blockers", "description": "Record known risks, blockers, and the decision or escalation needed; write None when empty.", "required": true, "multiline": true},
    {"id": "verification", "label": "Verification and Evidence", "description": "List commands, checks, reviewers, and evidence required before handoff.", "required": true, "multiline": true}
  ],
  "types": [
    {
      "id": "epic",
      "displayName": "Epic",
      "description": "A multi-feature outcome that needs decomposition and success measures.",
      "origin": {"kind": "core", "id": "core"},
      "canonicalCategory": "epic",
      "hierarchy": {"parentTypes": [], "childTypes": ["feature"]},
      "taskPacketFields": ["workItemType", "title", "spec", "acceptanceCriteria", "verification", "targetRepo"],
      "sourcePath": "templates/epic.md",
      "sections": [
        {"id": "objective", "label": "Strategic Objective", "description": "Describe the durable objective and intended beneficiaries.", "required": true, "multiline": true},
        {"id": "success-measures", "label": "Success Measures", "description": "Define measurable outcome indicators and evaluation timing.", "required": true, "multiline": true},
        {"id": "boundaries", "label": "Boundaries", "description": "Define organizational, product, and architectural boundaries.", "required": true, "multiline": true},
        {"id": "child-features", "label": "Child Features", "description": "List known child features or the decomposition plan.", "required": true, "multiline": true}
      ],
      "providerMappings": {"github": {"issueType": "Feature"}, "azureDevOps": {"workItemType": "Epic"}}
    },
    {
      "id": "feature",
      "displayName": "Feature",
      "description": "A cohesive user or business capability with measurable acceptance.",
      "origin": {"kind": "core", "id": "core"},
      "canonicalCategory": "feature",
      "hierarchy": {"parentTypes": ["epic"], "childTypes": ["task", "bug"]},
      "taskPacketFields": ["workItemType", "title", "spec", "acceptanceCriteria", "verification", "targetRepo"],
      "sourcePath": "templates/feature.md",
      "sections": [
        {"id": "beneficiaries", "label": "Users and Business Outcome", "description": "Identify beneficiaries and the capability or outcome delivered.", "required": true, "multiline": true},
        {"id": "behavior", "label": "Expected Behavior", "description": "Describe externally observable behavior and important constraints.", "required": true, "multiline": true}
      ],
      "providerMappings": {"github": {"issueType": "Feature"}, "azureDevOps": {"workItemType": "Feature"}}
    },
    {
      "id": "task",
      "displayName": "Task",
      "description": "An issue-sized implementation, documentation, test, or operational change.",
      "origin": {"kind": "core", "id": "core"},
      "canonicalCategory": "task",
      "hierarchy": {"parentTypes": ["epic", "feature"], "childTypes": []},
      "taskPacketFields": ["workItemType", "title", "spec", "acceptanceCriteria", "verification", "targetRepo"],
      "sourcePath": "templates/task.md",
      "sections": [
        {"id": "change", "label": "Concrete Change", "description": "Describe the files, systems, or behavior to change.", "required": true, "multiline": true},
        {"id": "completion", "label": "Completion Conditions", "description": "State the conditions that make the task ready for handoff.", "required": true, "multiline": true}
      ],
      "providerMappings": {"github": {"issueType": "Task"}, "azureDevOps": {"workItemType": "Task"}}
    },
    {
      "id": "bug",
      "displayName": "Bug",
      "description": "An unexpected or incorrect behavior requiring reproduction and regression evidence.",
      "origin": {"kind": "core", "id": "core"},
      "canonicalCategory": "bug",
      "hierarchy": {"parentTypes": ["epic", "feature"], "childTypes": ["task"]},
      "taskPacketFields": ["workItemType", "title", "spec", "acceptanceCriteria", "verification", "targetRepo"],
      "sourcePath": "templates/bug.md",
      "sections": [
        {"id": "observed", "label": "Observed Behavior", "description": "Describe what happens, including exact errors when safe.", "required": true, "multiline": true},
        {"id": "expected", "label": "Expected Behavior", "description": "Describe the correct behavior.", "required": true, "multiline": true},
        {"id": "reproduction", "label": "Reproduction", "description": "Provide deterministic reproduction steps and frequency.", "required": true, "multiline": true},
        {"id": "environment", "label": "Environment", "description": "Record relevant versions, platform, configuration, and data conditions without secrets.", "required": true, "multiline": true},
        {"id": "impact", "label": "Impact and Severity", "description": "Describe affected users or systems and justify severity.", "required": true, "multiline": true},
        {"id": "regression", "label": "Regression Evidence", "description": "Identify the regression test or evidence that will prevent recurrence.", "required": true, "multiline": true}
      ],
      "providerMappings": {"github": {"issueType": "Bug"}, "azureDevOps": {"workItemType": "Bug"}}
    },
    {
      "id": "spike",
      "displayName": "Spike",
      "description": "A bounded investigation that produces evidence and a decision rather than production scope.",
      "origin": {"kind": "core", "id": "core"},
      "canonicalCategory": "spike",
      "hierarchy": {"parentTypes": ["epic", "feature", "task"], "childTypes": []},
      "taskPacketFields": ["workItemType", "title", "spec", "acceptanceCriteria", "verification", "targetRepo"],
      "sourcePath": "templates/spike.md",
      "sections": [
        {"id": "question", "label": "Decision Question", "description": "State the single decision or uncertainty this spike resolves.", "required": true, "multiline": true},
        {"id": "effort-box", "label": "Effort Box", "description": "Set a fixed investigation limit and stopping condition.", "required": true, "multiline": false},
        {"id": "approach", "label": "Investigation Approach", "description": "List experiments, prototypes, sources, and comparisons.", "required": true, "multiline": true},
        {"id": "decision-artifact", "label": "Decision Artifact", "description": "Name the expected recommendation, ADR, prototype, or evidence report.", "required": true, "multiline": true}
      ],
      "providerMappings": {"github": {"issueType": "Task"}, "azureDevOps": {"workItemType": "Task"}}
    },
    {
      "id": "incident",
      "displayName": "Incident",
      "description": "An active or resolved service disruption tracked through recovery and follow-up.",
      "origin": {"kind": "core", "id": "core"},
      "canonicalCategory": "incident",
      "hierarchy": {"parentTypes": ["epic"], "childTypes": ["bug", "task", "change"]},
      "taskPacketFields": ["workItemType", "title", "spec", "acceptanceCriteria", "verification", "targetRepo"],
      "sourcePath": "templates/incident.md",
      "sections": [
        {"id": "severity-impact", "label": "Severity and Impact", "description": "State affected users, systems, regions, and business impact.", "required": true, "multiline": true},
        {"id": "detection", "label": "Detection and Current State", "description": "Record detection time, signal, owner, and present state.", "required": true, "multiline": true},
        {"id": "timeline", "label": "Timeline", "description": "Record material events and decisions in chronological order.", "required": true, "multiline": true},
        {"id": "mitigation", "label": "Mitigation and Recovery", "description": "Describe containment, recovery, validation, and rollback readiness.", "required": true, "multiline": true},
        {"id": "follow-up", "label": "Follow-up Work", "description": "List corrective bugs, changes, and learning actions.", "required": true, "multiline": true}
      ],
      "providerMappings": {"github": {"issueType": "Bug"}, "azureDevOps": {"workItemType": "Bug"}}
    },
    {
      "id": "risk",
      "displayName": "Risk",
      "description": "A potential event or condition requiring ownership, mitigation, and contingency.",
      "origin": {"kind": "core", "id": "core"},
      "canonicalCategory": "risk",
      "hierarchy": {"parentTypes": ["epic", "feature"], "childTypes": ["task", "change"]},
      "taskPacketFields": ["workItemType", "title", "spec", "acceptanceCriteria", "verification", "targetRepo"],
      "sourcePath": "templates/risk.md",
      "sections": [
        {"id": "risk-statement", "label": "Risk Statement", "description": "Describe the cause, uncertain event, and consequence.", "required": true, "multiline": true},
        {"id": "probability-impact", "label": "Probability and Impact", "description": "Assess likelihood, impact, and rationale.", "required": true, "multiline": true},